{"version":1,"metadata":{"title":"HELAIAN MATA PRU-15 P.034 SETIU","sourceFile":"TERENGGANU/P.034 SETIU.pdf","sourceSha256":"072524293aa4e611b7eb571f6ecfed7723aa6f721a0821ff7651661666444e5c","sourcePages":11,"printDate":"2022-11-19"},"parliamentCode":"P.034","registeredVoters":107294,"candidateColumns":[{"candidateId":"p034:abdul-rahman-bin-mat-yasin","candidateName":"ABDUL RAHMAN BIN MAT YASIN","column":1,"projectVotes":31736,"scoresheetVotes":31736},{"candidateId":"p034:ustaz-zukirnain-abd-kadir","candidateName":"USTAZ ZUKIRNAIN ABD KADIR","column":2,"projectVotes":50768,"scoresheetVotes":50768},{"candidateId":"p034:mohamad-bin-ngah","candidateName":"MOHAMAD BIN NGAH","column":3,"projectVotes":2125,"scoresheetVotes":2125},{"candidateId":"p034:wan-adnan","candidateName":"WAN ADNAN","column":4,"projectVotes":203,"scoresheetVotes":203}],"rows":[{"id":"P.034:postal:1","section":"postal","sequence":1,"pollingDistrictId":null,"pollingCentreId":null,"streamNumber":null,"ballotsInBox":1832,"candidateVotes":{"p034:abdul-rahman-bin-mat-yasin":604,"p034:ustaz-zukirnain-abd-kadir":921,"p034:mohamad-bin-ngah":39,"p034:wan-adnan":5},"validVotes":1569,"rejectedVotes":112,"unreturnedVotes":151},{"id":"P.034:034/06/00:1","section":"early","sequence":2,"pollingDistrictId":"P.034:034/06/00","pollingCentreId":"P.034:034/06/00:dewan-abdul-ghafar-rajab-ibu-pejabat-polis-daerah-setiu","streamNumber":1,"ballotsInBox":216,"candidateVotes":{"p034:abdul-rahman-bin-mat-yasin":92,"p034:ustaz-zukirnain-abd-kadir":119,"p034:mohamad-bin-ngah":2,"p034:wan-adnan":1},"validVotes":214,"rejectedVotes":2,"unreturnedVotes":0},{"id":"P.034:034/07/00:1","section":"early","sequence":3,"pollingDistrictId":"P.034:034/07/00","pollingCentreId":"P.034:034/07/00:bilik-maklumat-balai-polis-sungai-tong","streamNumber":1,"ballotsInBox":16,"candidateVotes":{"p034:abdul-rahman-bin-mat-yasin":12,"p034:ustaz-zukirnain-abd-kadir":4,"p034:mohamad-bin-ngah":0,"p034:wan-adnan":0},"validVotes":16,"rejectedVotes":0,"unreturnedVotes":0},{"id":"P.034:034/08/00:1","section":"early","sequence":4,"pollingDistrictId":"P.034:034/08/00","pollingCentreId":"P.034:034/08/00:bilik-maklumat-balai-polis-batu-rakit","streamNumber":1,"ballotsInBox":53,"candidateVotes":{"p034:abdul-rahman-bin-mat-yasin":29,"p034:ustaz-zukirnain-abd-kadir":22,"p034:mohamad-bin-ngah":1,"p034:wan-adnan":0},"validVotes":52,"rejectedVotes":1,"unreturnedVotes":0},{"id":"P.034:034/08/00:1","section":"ordinary","sequence":5,"pollingDistrictId":"P.034:034/08/00","pollingCentreId":"P.034:034/08/00:bilik-maklumat-balai-polis-batu-rakit","streamNumber":1,"ballotsInBox":370,"candidateVotes":{"p034:abdul-rahman-bin-mat-yasin":161,"p034:ustaz-zukirnain-abd-kadir":200,"p034:mohamad-bin-ngah":6,"p034:wan-adnan":1},"validVotes":368,"rejectedVotes":2,"unreturnedVotes":0},{"id":"P.034:034/08/00:2","section":"ordinary","sequence":6,"pollingDistrictId":"P.034:034/08/00","pollingCentreId":"P.034:034/08/00:bilik-maklumat-balai-polis-batu-rakit","streamNumber":2,"ballotsInBox":485,"candidateVotes":{"p034:abdul-rahman-bin-mat-yasin":188,"p034:ustaz-zukirnain-abd-kadir":279,"p034:mohamad-bin-ngah":9,"p034:wan-adnan":1},"validVotes":477,"rejectedVotes":8,"unreturnedVotes":0},{"id":"P.034:034/08/00:3","section":"ordinary","sequence":7,"pollingDistrictId":"P.034:034/08/00","pollingCentreId":"P.034:034/08/00:bilik-maklumat-balai-polis-batu-rakit","streamNumber":3,"ballotsInBox":407,"candidateVotes":{"p034:abdul-rahman-bin-mat-yasin":134,"p034:ustaz-zukirnain-abd-kadir":258,"p034:mohamad-bin-ngah":8,"p034:wan-adnan":3},"validVotes":403,"rejectedVotes":4,"unreturnedVotes":0},{"id":"P.034:034/08/00:4","section":"ordinary","sequence":8,"pollingDistrictId":"P.034:034/08/00","pollingCentreId":"P.034:034/08/00:bilik-maklumat-balai-polis-batu-rakit","streamNumber":4,"ballotsInBox":391,"candidateVotes":{"p034:abdul-rahman-bin-mat-yasin":112,"p034:ustaz-zukirnain-abd-kadir":260,"p034:mohamad-bin-ngah":12,"p034:wan-adnan":1},"validVotes":385,"rejectedVotes":6,"unreturnedVotes":0},{"id":"P.034:034/05/01:5","section":"ordinary","sequence":9,"pollingDistrictId":"P.034:034/05/01","pollingCentreId":"P.034:034/05/01:sekolah-kebangsaan-jabi","streamNumber":5,"ballotsInBox":484,"candidateVotes":{"p034:abdul-rahman-bin-mat-yasin":177,"p034:ustaz-zukirnain-abd-kadir":290,"p034:mohamad-bin-ngah":15,"p034:wan-adnan":1},"validVotes":483,"rejectedVotes":1,"unreturnedVotes":0},{"id":"P.034:034/05/01:1","section":"ordinary","sequence":10,"pollingDistrictId":"P.034:034/05/01","pollingCentreId":"P.034:034/05/01:sekolah-kebangsaan-jabi","streamNumber":1,"ballotsInBox":372,"candidateVotes":{"p034:abdul-rahman-bin-mat-yasin":136,"p034:ustaz-zukirnain-abd-kadir":208,"p034:mohamad-bin-ngah":13,"p034:wan-adnan":2},"validVotes":359,"rejectedVotes":13,"unreturnedVotes":0},{"id":"P.034:034/05/01:2","section":"ordinary","sequence":11,"pollingDistrictId":"P.034:034/05/01","pollingCentreId":"P.034:034/05/01:sekolah-kebangsaan-jabi","streamNumber":2,"ballotsInBox":367,"candidateVotes":{"p034:abdul-rahman-bin-mat-yasin":127,"p034:ustaz-zukirnain-abd-kadir":212,"p034:mohamad-bin-ngah":21,"p034:wan-adnan":4},"validVotes":364,"rejectedVotes":3,"unreturnedVotes":0},{"id":"P.034:034/05/01:3","section":"ordinary","sequence":12,"pollingDistrictId":"P.034:034/05/01","pollingCentreId":"P.034:034/05/01:sekolah-kebangsaan-jabi","streamNumber":3,"ballotsInBox":444,"candidateVotes":{"p034:abdul-rahman-bin-mat-yasin":141,"p034:ustaz-zukirnain-abd-kadir":275,"p034:mohamad-bin-ngah":21,"p034:wan-adnan":1},"validVotes":438,"rejectedVotes":6,"unreturnedVotes":0},{"id":"P.034:034/05/01:4","section":"ordinary","sequence":13,"pollingDistrictId":"P.034:034/05/01","pollingCentreId":"P.034:034/05/01:sekolah-kebangsaan-jabi","streamNumber":4,"ballotsInBox":430,"candidateVotes":{"p034:abdul-rahman-bin-mat-yasin":114,"p034:ustaz-zukirnain-abd-kadir":299,"p034:mohamad-bin-ngah":10,"p034:wan-adnan":1},"validVotes":424,"rejectedVotes":6,"unreturnedVotes":0},{"id":"P.034:034/05/01:5","section":"ordinary","sequence":14,"pollingDistrictId":"P.034:034/05/01","pollingCentreId":"P.034:034/05/01:sekolah-kebangsaan-jabi","streamNumber":5,"ballotsInBox":453,"candidateVotes":{"p034:abdul-rahman-bin-mat-yasin":113,"p034:ustaz-zukirnain-abd-kadir":319,"p034:mohamad-bin-ngah":17,"p034:wan-adnan":1},"validVotes":450,"rejectedVotes":3,"unreturnedVotes":0},{"id":"P.034:034/05/02:6","section":"ordinary","sequence":15,"pollingDistrictId":"P.034:034/05/02","pollingCentreId":"P.034:034/05/02:sekolah-kebangsaan-apal","streamNumber":6,"ballotsInBox":497,"candidateVotes":{"p034:abdul-rahman-bin-mat-yasin":154,"p034:ustaz-zukirnain-abd-kadir":321,"p034:mohamad-bin-ngah":15,"p034:wan-adnan":1},"validVotes":491,"rejectedVotes":6,"unreturnedVotes":0},{"id":"P.034:034/05/02:1","section":"ordinary","sequence":16,"pollingDistrictId":"P.034:034/05/02","pollingCentreId":"P.034:034/05/02:sekolah-kebangsaan-apal","streamNumber":1,"ballotsInBox":363,"candidateVotes":{"p034:abdul-rahman-bin-mat-yasin":146,"p034:ustaz-zukirnain-abd-kadir":204,"p034:mohamad-bin-ngah":4,"p034:wan-adnan":0},"validVotes":354,"rejectedVotes":9,"unreturnedVotes":0},{"id":"P.034:034/05/02:2","section":"ordinary","sequence":17,"pollingDistrictId":"P.034:034/05/02","pollingCentreId":"P.034:034/05/02:sekolah-kebangsaan-apal","streamNumber":2,"ballotsInBox":389,"candidateVotes":{"p034:abdul-rahman-bin-mat-yasin":133,"p034:ustaz-zukirnain-abd-kadir":235,"p034:mohamad-bin-ngah":13,"p034:wan-adnan":4},"validVotes":385,"rejectedVotes":4,"unreturnedVotes":0},{"id":"P.034:034/05/02:3","section":"ordinary","sequence":18,"pollingDistrictId":"P.034:034/05/02","pollingCentreId":"P.034:034/05/02:sekolah-kebangsaan-apal","streamNumber":3,"ballotsInBox":456,"candidateVotes":{"p034:abdul-rahman-bin-mat-yasin":155,"p034:ustaz-zukirnain-abd-kadir":286,"p034:mohamad-bin-ngah":7,"p034:wan-adnan":2},"validVotes":450,"rejectedVotes":6,"unreturnedVotes":0},{"id":"P.034:034/05/02:4","section":"ordinary","sequence":19,"pollingDistrictId":"P.034:034/05/02","pollingCentreId":"P.034:034/05/02:sekolah-kebangsaan-apal","streamNumber":4,"ballotsInBox":420,"candidateVotes":{"p034:abdul-rahman-bin-mat-yasin":136,"p034:ustaz-zukirnain-abd-kadir":272,"p034:mohamad-bin-ngah":8,"p034:wan-adnan":2},"validVotes":418,"rejectedVotes":2,"unreturnedVotes":0},{"id":"P.034:034/05/02:5","section":"ordinary","sequence":20,"pollingDistrictId":"P.034:034/05/02","pollingCentreId":"P.034:034/05/02:sekolah-kebangsaan-apal","streamNumber":5,"ballotsInBox":437,"candidateVotes":{"p034:abdul-rahman-bin-mat-yasin":128,"p034:ustaz-zukirnain-abd-kadir":294,"p034:mohamad-bin-ngah":10,"p034:wan-adnan":2},"validVotes":434,"rejectedVotes":3,"unreturnedVotes":0},{"id":"P.034:034/05/03:6","section":"ordinary","sequence":21,"pollingDistrictId":"P.034:034/05/03","pollingCentreId":"P.034:034/05/03:sekolah-kebangsaan-kerandang","streamNumber":6,"ballotsInBox":485,"candidateVotes":{"p034:abdul-rahman-bin-mat-yasin":155,"p034:ustaz-zukirnain-abd-kadir":314,"p034:mohamad-bin-ngah":11,"p034:wan-adnan":1},"validVotes":481,"rejectedVotes":4,"unreturnedVotes":0},{"id":"P.034:034/05/03:1","section":"ordinary","sequence":22,"pollingDistrictId":"P.034:034/05/03","pollingCentreId":"P.034:034/05/03:sekolah-kebangsaan-kerandang","streamNumber":1,"ballotsInBox":384,"candidateVotes":{"p034:abdul-rahman-bin-mat-yasin":181,"p034:ustaz-zukirnain-abd-kadir":193,"p034:mohamad-bin-ngah":5,"p034:wan-adnan":3},"validVotes":382,"rejectedVotes":2,"unreturnedVotes":0},{"id":"P.034:034/05/03:2","section":"ordinary","sequence":23,"pollingDistrictId":"P.034:034/05/03","pollingCentreId":"P.034:034/05/03:sekolah-kebangsaan-kerandang","streamNumber":2,"ballotsInBox":515,"candidateVotes":{"p034:abdul-rahman-bin-mat-yasin":218,"p034:ustaz-zukirnain-abd-kadir":284,"p034:mohamad-bin-ngah":8,"p034:wan-adnan":1},"validVotes":511,"rejectedVotes":4,"unreturnedVotes":0},{"id":"P.034:034/05/03:3","section":"ordinary","sequence":24,"pollingDistrictId":"P.034:034/05/03","pol